,mission and vision
helvetica_neue,"Ook voor de in- en verkoop van motoren, voor de verkoop van motorkleding en voor winterstalling van uw motor kunt u bij ons terecht.In ons bedrijfspand op het bedrijventerrein van Ten Boer hebben we gescheiden werkplaatsen voor motoren en auto's.Naast de werkplaats is er een showroom voor motoren en motorkleding.Ook kunt u uw auto wassen in de volledig automatische wasstraat, of uw auto of motor met de hand wassen in de wasbox."
helvetica_neue,"Today, experiential learning is a cornerstone of modern education."
helvetica_neue,"For Academia, it has been the philosophy behind every program for over 20 years.Accredited by British awarding body and national accreditation bodies Academia Colleges offer students short-cycle higher education diploma programmes in Business, Engineering and Art & Design."
helvetica_neue,"MyAnimeList is a website aimed at anime fans globally, and includes features such as a database of over 40,000 entries and highly active forums."
helvetica_neue,"It is becoming the heart for sharing, discussing and discovering anime and manga information in the English speaking world.The website is currently operated by MyAnimeList, LLC, the U.S. subsidiary of Tokyo-based DeNA."
helvetica_neue,"Zoosk is a leading online dating company founded by engineers, and has a solid history of iterating on what works best for our customers to help them fall in ?like? and eventually love."
helvetica_neue,"Our smart, passionate employees collaborate across departments to help achieve our mission to empower everyone to lead a more fulfilling love life."
helvetica_neue,"With over 35 million active members in 80+ countries and top dating apps for both Android and iOS, we?re a lot more than just a fun place to work.Check out Zoosk at the following sites.http://techcrunch.com/2014/02/13/tc-cribs-zoosk/http://officesnapshots.com/2013/10/07/inside-zoosks-san-francisco-offices/http://www.themuse.com/companies/zoosk"
helvetica_neue,MarineTraffic is the leading maritime information service used by shipping professionals to support their decisions and by maritime enthusiasts to track any ship in the world.
helvetica_neue,"Founded in 2007, the company has always been dedicated to making maritime information universally accessible."
helvetica_neue,"MarineTraffic relies upon a dynamic team delivering innovative digital solutions that drive efficiency and, ultimately, improve the maritime ecosystem as a whole."
helvetica_neue,All MarineTraffic solutions are powered by data.
helvetica_neue,Global real-time and historical ship positions combined with various data sources and analysis techniques result in a highly comprehensive source of actionable maritime intelligence.
helvetica_neue,"Welcome to MarineTraffic, the global ship tracking intelligence platform!"
helvetica_neue,"At IBM, work is more than a job - it's a calling: To build."
helvetica_neue,To design.
helvetica_neue,To code.
helvetica_neue,To consult.
helvetica_neue,To think along with clients and sell.
helvetica_neue,To make markets.
helvetica_neue,To invent.
helvetica_neue,To collaborate.
helvetica_neue,"Not just to do something better, but to attempt things you've never thought possible."
helvetica_neue,To lead in this new era of technology and solve some of the world's most challenging problems.
helvetica_neue,IBM is a leading cloud platform and cognitive solutions company.
helvetica_neue,"Restlessly reinventing since 1911, we are the largest technology and consulting employer in the world, with more than 380,000 employees serving clients in 170 countries."
helvetica_neue,"With Watson, the AI platform for business, powered by data, we are building industry-based solutions to real-world problems."
helvetica_neue,"For more than seven decades, IBM Research has defined the future of information technology with more than 3,000 researchers in 12 labs located across six continents."
helvetica_neue,"For more information, visit www.ibm.com."
helvetica_neue,This is IBM's official LinkedIn account and it follows IBM Social Computing Guidelines.
helvetica_neue,"We reserve the right to delete comments that are offensive or suggestive, personal attacks, anonymous, wildly off-topic, spam or advertisements."
helvetica_neue,"For more information regarding IBM?s social computing guidelines, visit http://ibm.co/1LRDq6F"
helvetica_neue,"HITC, digitally native since 2000, bringing you news and sometimes irreverent views, specialising in business, sport, tech, lifestyle, and politics."
verdana,Congratulations!
verdana,You just found the official LinkedIn page of happiest e-commerce to work in Indonesia!
verdana,"Don?t go just yet, because if you do, you are going to miss out on a happy opportunity."
verdana,"As one of the fastest growing e-commerce in Indonesia, elevenia.co.id is a company of happy employers and employees that aims for the happiness of its buyers and sellers.Our business involves giving the best service to our customers, and giving the best support to our sellers."
verdana,"As a marketplace, elevenia acts as a platform between our sellers and buyers online."
verdana,"We are currently responsible for the business growth of our 33.000 sellers and happiness of our 2,3 million members.Officially launched in March 2014, elevenia now has several achievements including:- Marketing Awards 2015- Best Innovation e-commerceAll of those achievements are nothing without the hard work of our happy employees currently working today at our office."
verdana,"As an elevenian, we strongly believe in the positive minds and attitude for the growth of a great company.Come and join our family by sending your CV, or just have a look at our website here: http://www.elevenia.co.id/career.doSee you soon!"
verdana,"Rackspace is the #1 provider of IT as a service, in today?s multi-cloud world."
verdana,"We deliver certified expertise and integrated managed services across public and private clouds, managed hosting and enterprise applications."
verdana,"Because Rackspace partners with the leading technology providers, including Alibaba?, AWS, Google?, Microsoft?, OpenStack?, Oracle?, SAP? and VMware?, we are uniquely positioned to provide unbiased advice on the technologies that will best serve each customer?s specific needs."
verdana,"Rackspace was named a leader in the 2017 Gartner Magic Quadrant for Public Cloud Infrastructure Managed Service Providers, Worldwide and has been honored by Fortune, Glassdoor and others as one of the best places to work."
verdana,"Based in San Antonio, Texas, Rackspace serves more than 150,000 business customers, including a majority of the Fortune 100, from data centers on five continents."
verdana,Learn more at www.rackspace.com.
verdana,"BAMA Gruppen AS er det ledende selskapet i Norge innen fersk frukt, gr?nnsaker, b?r og poteter til dagligvare-, storkj?kken- og servicemarkedet."
verdana,"I tillegg har vi en voksende posisjon innen blomster og har internasjonal virksomhet etablert i Sverige, Polen og Holland."
verdana,Vi er en global akt?r med stor kontaktflate og handler fra over 1300 leverand?rer fra alle kontinenter.
verdana,"V?r rolle i verdikjeden er ? p?ta oss hele logistikkansvaret fra inn- og utland frem til v?re kunder i Norge.I Norge har vi produksjonsbedrifter innen ferskforedlede salater, gr?nnsaker og poteter, samt ferske m?ltidsl?sninger."
verdana,V?rt driftsapparat er representert i hele landet og h?ndterer ca.
verdana,14 000 daglige leveranser.
verdana,"Vi er en kommersiell akt?r med m?l om ? skape vekst i forbruket av frukt og gr?nt, i tr?d med de helse- og ern?ringsmessige m?lene i Norge."
verdana,"Gjennom ? realisere v?r visjon, skal vi bidra til en positiv samfunnsutvikling, der sunnere kosthold og ?kt aktivitet st?r ?verst p? agendaen."
verdana,"Konsernet har 2000 ansatte og omsatte i 2014 for 13,5 milliarder kroner."
verdana,"We are Europe's leading airline, operating on 830 routes across more than 30 countries with our fleet of over 250 Airbus aircraft."
verdana,Last year we flew over 70 million passengers.
verdana,"We employ over 10,000 people including 2,300 pilots and 5000 cabin crew."
verdana,"We?re the UK?s largest airline, the fourth largest in Europe and the tenth largest in the world."
verdana,It?s big-scale stuff and we?re still growing.We can't answer customer service queries on LinkedIn but you can get in touch with us via Facebook  (http://www.facebook.com/easyJet) and Twitter (http://www.twitter.com/easyJet).You can also find lots of information in the help section of our website: http://www.easyJet.com/help
verdana,"SQUARE ENIX HOLDINGS CO., LTD. with headquarters in Tokyo, Japan, is a holding company leading the Square Enix Group with a diverse range of content and service businesses.The Square Enix Group publishes, distributes and licenses entertainment content around the world under its internationally renowned brands including SQUARE ENIX?, EIDOS? and TAITO?.The Square Enix Group includes a global network of leading development studios located in North America, Europe and Japan."
verdana,"The Group boasts a valuable portfolio of intellectual property including: FINAL FANTASY?, which has sold over 100 million units worldwide, DRAGON QUEST?, which has sold over 58 million units worldwide and TOMB RAIDER?, which has sold over 35 million units worldwide, and the legendary SPACE INVADERS?."
verdana,"Pearson eCollege is a leading provider of an integrated, standards-based eLearning software solution to the post-secondary and K-12 education industries."
verdana,"Not just an online education solution, eCollege also provides all of the services associated with creating and maintaining quality online education programs."
verdana,"eCollege builds and supports some of the most successful, online degree, certificate/diploma and professional development programs in the country.The Pearson eCollege eLearning software solution?s main component is a hosted, on-demand Course Management System for both the Higher Education and K-12 education industries."
verdana,"These online education systems are bundled with an effective Program Administration System, as well as a host of additional tools and services.Pearson eCollege, as part of the world's leading education company, has partnerships with multiple leaders in the educational content and technology fields."
verdana,Stability and broad solution partnerships contribute to improved online education programs for all institutions using the Pearson eCollege learning platform.
verdana,"Orquestadores de TI, transformadores de modelo operativo de TI e innovadores de servicios para la TI"
verdana,Wowhead was created with one sole intent: providing World of Warcraft players with tools to make their gameplay more enjoyable.New and exciting features are continuously added in order to stay ahead as the leading World of Warcraft information website.
verdana,"We are constantly striving to improve the site, and there are always lots of new features in the works!"
verdana,QIWI is a leading provider of next generation payment services in Russia and the CIS.
verdana,"It has an integrated proprietary network that enables payment services across physical, online and mobile channels."
verdana,"It has deployed over 17.3 million virtual wallets, over 177,000 kiosks and terminals, and enabled merchants to accept over RUB 50 billion cash and electronic payments monthly from over 70 million consumers using its network at least once a month."
verdana,"QIWI?s consumers can use cash, stored value and other electronic payment methods to order and pay for goods and services across physical or online environments interchangeably.QIWI ? ??????? ????????? ?????? ?????? ????????? ? ?????? ? ??????? ???, ???????? ??????????? ??????????????? ????????? ????, ??????????? ??????????? ??????? ?? ??????????, ???????? ? ????????? ??????? ?????."
verdana,"??? ???????? ????? 17,3 ??? ??????????? ????????? ? ????? 177 000 ?????????? ? ????? ?????? ????????."
verdana,? ??????? QIWI ???????? ???????? ????????? ??????? (? ???????? ? ??????????? ?????) ?? ????? ????? 50 ???? ???.
verdana,"?? ????? ??? 70 ??? ????????, ??????? ?????????? ???????? ???? ?? ???? ?????? ???? ? ?????."
verdana,"??????? QIWI ????? ???????????? ????????, ?????????????? ????? ? ?????? ??????? ??????????? ???????? ??? ?????? ? ?????? ??????? ? ?????, ????????? ?????????? ? ??????????? ????????? ??????????? ???????????."
verdana,"Cr?dit Agricole Group is the leading financial partner to the French economy and one of the largest banking groups in Europe.It is the leading retail bank in Europe as well as the first European asset manager, the first bancassurer in Europe and the third European player in project finance."
verdana,"Built on its strong cooperative and mutual roots, its 138,000 employees and the 31,000 directors of its Local and Regional Banks, Cr?dit Agricole  Group is a responsible and responsive bank serving 52 million customers, 9.3 million mutual shareholders and 1.1 million individual shareholders.Thanks to its universal customer-focused retail banking model ? based on the cooperation between its retail banks and their related business lines ?, Cr?dit Agricole  Group supports its customers? projects in France and around the world: insurance, real estate, payments, asset management, leasing and factoring, consumer finance, corporate and investment banking."
verdana,"Cr?dit Agricole  also stands out for its dynamic, innovative corporate social responsibility policy, for the benefit of the economy."
verdana,This policy is based on a pragmatic approach which permeates across the Group and engages each employee.
verdana,ImmobilienScout24 is the leading online marketplace for private and commercial real estate in Germany.
verdana,"The portal enables people to realise their real estate dreams simply, efficiently and without any stress."
verdana,"ImmobilienScout24 successfully brings commercial real estate sellers, owners and potential tenants and buyers together."
verdana,"Every month, more than twelve million people use the portal (unique visitors, according to comScore Media Metrix)."
verdana,"Germany-wide, ImmobilienScout24 achieves a prompted brand recognition score of 96 per cent within the relevant target group."
verdana,"ImmobilienScout24 is part of the Scout24 Group, which operates leading digital marketplaces in the real estate and automotive sectors in Germany and other selected European countries."
verdana,"For more information, visit http://www.immobilienscout24.de."
verdana,"AbeBooks, an Amazon company, is an online marketplace for books and a remarkable place to work."
verdana,"Millions of new, used, rare and out-of-print books are offered for sale through the AbeBooks websites from thousands of booksellers around the world."
verdana,We helped to revolutionize the used book business.
verdana,AbeBooks became a subsidiary of Amazon.com Inc. after being acquired in December 2008.
verdana,"Our mission is to help people find and buy any book from any bookseller and our business stretches around the world with six international sites ??? AbeBooks.com, AbeBooks.co.uk, AbeBooks.de, AbeBooks.fr, AbeBooks.it, and IberLibro.com, as well as ZVAB.com, a marketplace for German books.To booklovers around the world, AbeBooks is a great place to buy books."
verdana,"However, we have always been a technology company that helps booksellers and book-buyers."
verdana,"Since 1996, our technology has been helping to revolutionize the book business and that quest goes on.Our technology workers are versatile, quick-thinking and thrive on deadlines."
verdana,They plan and build systems that will yield long-term tangible benefits but also drop everything when required to solve critical issues where every minute counts.
verdana,Anyone looking for a technology job at AbeBooks has to prove they are a flexible team player because there is no room for prima donnas.
verdana,"We do a lot with a relatively small number of people.We are devoted to Agile practices and methodologies in software engineering, and e-commerce is a business that never sleeps when it comes to site operations."
verdana,Our QA engineers are analytical on a global scale.
verdana,Scalability is the magic word for the database administrators while the product managers have vision and a get-it-done attitude.
verdana,Our web developers insist on the highest standards when building dynamic pages and user interfaces.
verdana,Do you have what it takes to join our team?
verdana,Focused on Investment in different sectors mostly in Real Estate.
verdana,"Zamzar is the primary online file conversion site on the Internet.We provide software and services to allow both consumers and businesses to convert files into a variety of different formats - document, image, video, audio, compressed, CAD and more.We offer:* A web application for simple file conversion at http://www.zamzar.com* A developer API to integrate file conversion into your business or app at https://developers.zamzar.comWorld class software since 2006:- At Zamzar we've been converting files for 10 years."
verdana,"We have customers from 245 countries (that's every country on the planet), including Antartica !- We have converted over 215 million files from over 100 million users - that's almost one file every second."
verdana,ANZ has a proud heritage of more than 180 years.Our purpose is to shape a world where people and communities thrive.
verdana,"That is why we strive to create a balanced, sustainable economy in which everyone can take part and build a better life.We employ more than 50,000 people and have our global headquarters in Melbourne."
verdana,"ANZ is among the top 4 banks in Australia, the largest banking group in New Zealand and Pacific, and among the top 50 banks in the world.Follow us elsewhere for our latest news:facebook.com/ShayneElliottANZfacebook.com/ANZAustraliafacebook.com/ANZNewZealandtwitter.com/ANZ_AUtwitter.com/ANZ_NZ twitter.com/ANZ_Mediatwitter.com/ANZ_BlueNotestwitter.com/ANZ_Researchinstagram.com/anz_au bluenotes.anz.comyourworld.anz.com"
verdana,"Jimdo is the easiest way to create a website on a desktop, smartphone, or tablet, with no coding required."
verdana,"Founders Matthias Henze, Fridtjof Detzner and Christian Springub started Jimdo in 2007 in an old farmhouse in Northern Germany."
verdana,"They had no budget, but shared a vision: build a tool that makes it fun for anyone to create their own website."
verdana,"Today, people from all over the world have built over 20 million Jimdo websites?online stores, blogs, portfolios, business websites, and more."
verdana,"Jimdo has offices in Hamburg and Tokyo, both of whom share the same goal: help users share their passions and build something truly great."
verdana,"Spirit of Iranian Noted Achievers (SINA) is a student-run organization founded to formally recognize and honor Iranians who have made outstanding contributions to the fields of the Arts, Business & Leadership, Engineering, Humanities, Medicine, Philanthropy, and Science."
verdana,"SINA is a non-political, non-religious and non-partisan organization that aims to provide future Iranian achievers with an encouraging and empowering environment."
verdana,"Through a series of lectures, talks, social events, and a worldwide conference aiming to recognize and grant awards to Iranian achievers (held in Boston, Massachusetts), we hope to promote the very best of our culture and encourage significant future achievements."
verdana,"Connecting, communicating, and creating an atmosphere for achievement are essential goals for SINA."
verdana,Founded in New York in 2003.
verdana,The agency's philosophy is in its name.
verdana,"For Hispanics ?ol?!? is an expression that celebrates creativity, enthusiasm and things well done."
verdana,That is OLE?s promise: clients should say ?ol?!? after seeing our work and what it does for their business.
verdana,"Reverso is one of the fastest development outline organizations in India, India."
verdana,"We are all that much seen as, an imaginative site organization in India for web plan."
verdana,Reverso has brought a refreshingly new approach to site outline and improvement in India..
verdana,Moving America Where it wants to go.We are not just a railroad; we are a company that moves people.
verdana,"With 21,000 route miles in 46 states, the District of Columbia and three Canadian provinces, Amtrak operates more than 300 trains each day ? at speeds up to 150 mph ? to more than 500 destinations."
verdana,We move customers where they want to go by responding to their wants and needs.
verdana,"And by doing so, we connect communities, economies and families that make our nation great.We employ more than 20,000 diverse, energetic professionals in a variety of career fields throughout the Unites States."
verdana,"Our mission is to provide safe transportation in the most efficient way possible, while ensuring that our customers get a consistent, high quality experience."
verdana,"Carrying out this mission, and ultimately achieving our vision, hinges on our employees.The future rides with us."
verdana,"Accenture is a leading global professional services company, providing a broad range of services and solutions in strategy, consulting, digital, technology and operations."
verdana,Combining unmatched experience and specialized skills across more than 40 industries and all business functions ? underpinned by the world?s largest delivery network ? Accenture works at the intersection of business and technology to help clients improve their performance and create sustainable value for their stakeholders.
verdana,"With approximately 425,000 people serving clients in more than 120 countries, Accenture drives innovation to improve the way the world works and lives."
verdana,Visit us at www.accenture.com.
verdana,"ZEDO, Inc. is a platform offering high impact formats."
verdana,"Known for technical innovation and ability to scale, ZEDO offers publishers products and services - including ad serving - and high impact formats with 99% viewable impressions."
verdana,"ZEDO also serves advertisers through ZINC, a suite of high impact formats including video and native ads on premium sites."
verdana,"Founded in 1999, ZEDO is headquartered in San Francisco with offices in New York, Los Angeles, Chicago, Seattle, and Phoenix, and development centers in Russia and India."
verdana,"As the largest independent ad server and the developer of high impact video formats for mobile devices, the company is distinguished by its global reach and technology leadership."
verdana,"La griffe d?Edmunds, un style uniqueInsortable le n?ud papillon ?"
verdana,"D?couvrez les exclusifs EdmundsEdmunds signe une collection de n?uds papillon ? porter ? tout moment, en toute occasion."
verdana,"Son atelier livre une collection imparable, aux mille et un motifs singuliers."
verdana,Tout n?ud Edmunds est cousu-main dans notre atelier en Belgique.
verdana,"Une ?quipe printani?re, qui dessine avec doigt? les tendances de demain.D?marquez une personnalit?, adoptez le style Edmunds."
verdana,"http://www.hi5.comLaunched in 2003, hi5 is one of the leading social networks in the world - ranked as a top 10 website globally and the #1 or #2 most-trafficked site in nearly a dozen countries, including many in Latin America, Europe and Asia."
verdana,"According to comScore, more than 50 million individuals every month visit hi5, which is currently available in 50 languages."
verdana,"hi5 is a privately-held company, headquartered in San Francisco, California."
verdana,"For more information, visit http://www.hi5networks.com."
verdana,"Turkey's newsroom Haberturk TV, Habert?rk Radio and the leader of internet news broadcasting haberturk.com, joined Ciner Media Holding family on 16 November 2007."
verdana,"From the day that it starts to broadcast, maintaining the principle of honest, true, fast and objective newscasting Habert?rk Television has taken place among the leader companies in media in a short time and in 2009, it became ?The Most Watched News Channel in Turkey?.Habert?rk, which give place to every news worth of broadcast, every opinion worth of state and fast reporting concept has made a big difference among the other news channels with cult programs such as Teke Tek, Sans?rs?z, Tarihin Arka Odas?, S?z Sende and experienced staff."
verdana,"Being the leader of internet news reporting in Turkey, haberturk.com has been selected as the most loved news internet site and proved once more that it is the ?Biggest Online Newspaper in Turkey? by  Ipsos KMG Digital Lovemark survey."
verdana,Haberturk.com continues to draw attention by means of the innovations and developments in the media sector.
verdana,"bet365, one of the world's leading online gambling companies and a driving force in the development of enterprise and Internet technology.Established by Denise Coates CBE in 2001, we have rapidly grown into a global operation."
verdana,"We employ over 3,000 people and deliver an unrivalled online experience to more than 21 million customers in 18 languages.Initially we began by offering online Sports Betting but a forward thinking Denise decided to focus the attention on In-Play betting."
verdana,The gamble paid off and enabled us to forge our leadership position.
verdana,"In-Play has been fundamental to our success and remains the cornerstone of a business which, in 2015-16, saw ?37 billion taken in Sports wagers ? with up to 1.5 million markets on site at any one time.Innovation continues to be our lifeblood."
verdana,"Driven by a shared vision to be the best in our industry, a technology team of over 600 people work in-house to provide the technological advances that enable us to maintain our leadership position.Giving our teams the freedom to innovate is essential to our success."
