,mission and vision
helvetica_neue,The Smartcool product line of green technologies reduces the electricity consumption (kWh) and demand (kW) of air conditioning and refrigeration compressors.The ESM? and ECO3? are unique retrofit solutions to make the compressors within air conditioning and refrigeration systems more efficient.
helvetica_neue,"Over 26,000 Smartcool products have been installed around the world ? several case studies in various vertical industries."
helvetica_neue,"Smartcool technology is used by some of the world?s leading corporations ? Tesco Supermarkets, Sainsbury?s, GE Healthcare, Radisson SAS and Telstra Corporation are just a few of Smartcool's international clients."
helvetica_neue,"In South Africa Aruba is successfully installed and assessed Smartcool technology at Vector Logistic (industrial refrigeration), Nedbank (commercial HVAC air conditioning) and Pick n Pay (food retail refrigeration)."
helvetica_neue,POPSUGAR Inc. is a global media and technology company including lifestyle media publisher POPSUGAR and monthly subscription box POPSUGAR Must Have.
helvetica_neue,"We deliver inspiring, informative, and entertaining multi-platform content across entertainment, fashion, beauty, fitness, food, parenting, news and more."
helvetica_neue,"We help women everywhere look good, feel good, do good ? to live more fulfilling lives every day.POPSUGAR Inc. operates internationally in Australia, the Middle East, and the UK, with offices in San Francisco, New York, Los Angeles, Chicago, and London."
helvetica_neue,The company is privately held and funded by Sequoia Capital and Institutional Venture Partners (IVP).
helvetica_neue,"Follow us on Twitter at @POPSUGARInc and for more information about the company, visit corp.popsugar.com"
helvetica_neue,"Founded in 1995 in San Jose, Calif., eBay (NASDAQ:EBAY) is where the world goes to shop, sell and give."
helvetica_neue,"Whether you?re buying new or used, common or luxurious, trendy or rare ? if it exists in the world, it?s probably for sale on eBay."
helvetica_neue,"Our great value and unique selection helps every person find their version of perfect, no matter what it is.We equip sellers with the tools, solutions and support they need to grow their businesses and thrive."
helvetica_neue,"We measure our success by our customers'\u200b success.Our vision for commerce is one that is enabled by people, powered by technology and open to everyone."
helvetica_neue,"Through our investments in small businesses and commitment to innovation, we?re connecting millions of buyers and sellers around the globe, creating economic opportunity for all.We also reach millions through specialized marketplaces such as StubHub, the world's largest ticket marketplace, and eBay Classifieds sites (e.g."
helvetica_neue,"Kijiji, Marktplaats, Gumtree), which together have a presence in more than 1,000 cities around the world."
helvetica_neue,For more information about the company visit http://www.ebayinc.com/our-company/
helvetica_neue,"Voonik is India\'s fastest growing Fashion Shopping App for women where you can buy fashion that suits your body, personality, lifestyle, and budget preferences."
helvetica_neue,"At Voonik, we are imagining how shopping will happen after 20 years and are trying to create the future NOW."
helvetica_neue,"Our technology will meld machine-based predictions with the power of expert curation to help solve the timeless problem: ""What should I wear today?"
helvetica_neue,"""Voonik is started by ISB Alumnus Sujayath Ali and his classmate in Engineering, Navaneetha Krishnan in March of 2013 with a desktop site as Voonik.com."
helvetica_neue,"Very early, Voonik recognised mobile-commerce is the way to future and have launched our Android app with Tinder-like interface."
helvetica_neue,"Within few months of launch, Voonik app has crossed million downloads and processes crores worth of monthly transactions."
helvetica_neue,"Currently, Voonik is the fastest growing fashion app in India, ahead of the likes of Limeroad and Craftsvilla, as of end of November.Voonik was incubated by Microsoft Ventures and is funded by marquee investors like Sequoia and Seedfund."
helvetica_neue,Voonik is backed by a strong team of ordinary individuals achieving extraordinary feats and contributing to the growth at breakneck speed.You too can be part of our team - visit careers.voonik.com
helvetica_neue,"LastPass manages your passwords and online life, so you don't have to."
helvetica_neue,"We've made going online easier and safer, and supporting all of your browsers, operating systems, and mobile devices since 2008."
helvetica_neue,"LastPass Enterprise scales SSO and password management for teams small and large, helping IT be more secure, maintain compliance, and increase productivity of the organization.The last password you'll ever have to remember.LogMeIn, Inc. (NASDAQ:LOGM) simplifies how people connect with each other and the world around them to drive meaningful interactions, deepen relationships, and create better outcomes for individuals and businesses."
helvetica_neue,"With millions of users worldwide, our cloud-based solutions make it possible for people and companies to connect and engage with their workplace, colleagues, customers and products anywhere, anytime."
helvetica_neue,Somos una agencia especialista en \u202aMarketing Digital.
helvetica_neue,"Nuestros servicios tienen como objetivos espec?ficos el posicionamiento de tu negocio, la captaci?n y fidelizaci?n de nuevos clientes y el incremento de tus ventas."
helvetica_neue,"Creamos las mejores campa?as y los mejores contenidos para tus redes sociales, dise?amos entretenidas gr?ficas que cautivaran a tu audiencia y gestionamos todas tus cuentas sociales con las mejores herramientas del mercado."
helvetica_neue,"StubHub is the world?s largest ticket marketplace with tickets available for more than 10 million live sports, music and theater events in more than 40 countries."
helvetica_neue,"We enable fans to buy and sell tickets whenever and wherever they are through our desktop and mobile experiences.Through a variety of partnerships and ongoing refinements to our tech stack, we?re always looking for ways to improve our product offering and connect even more people with live events, worldwide."
helvetica_neue,"Our global and North American business partners include more than 60 in MLB, NBA, NHL, MLS and NCAA, AEG, AXS and Spectra Ticketing & Fan Engagement, as well as the O2 Arena and Tottenham Hotspur in the UK."
helvetica_neue,"In 2016, we pioneered a first-of-its-kind platform with the Philadelphia 76ers, creating a one-stop source for buying and selling 76ers tickets."
helvetica_neue,"With the acquisition of Ticketbis in May 2016, StubHub has expanded into over 40 additional markets, making us a truly global organization.We are courageous."
helvetica_neue,We are driven.
helvetica_neue,We are inventive.
helvetica_neue,We are richly diverse.
helvetica_neue,We are the brand.
helvetica_neue,We are StubHub One.StubHub is an eBay company (NASDAQ: EBAY).
helvetica_neue,"Recognised as the world?s first, and largest online marketplace for icons, Iconfinder provides unique, high-quality icons and symbols for designers, developers and creative professionals."
helvetica_neue,"Our online database allows users to efficiently search, filter and target image designs, according to their specific project needs.From inception in 2007, Iconfinder has been helping thousands of designers and contributing illustrators from around the globe ?make a living, doing what they love? drawing, uploading and selling their original artwork."
helvetica_neue,"As a result of this work, users can instantly access an extensive online source of over 1,000,000 icons, created to a superior standard."
helvetica_neue,"Whether they are used to style websites, apps, aid presentations or shape reports."
helvetica_neue,"Millions of icons are downloaded each month, solidifying Iconfinder as the most popular icon site to date.For creative websites, builders and other software tools, Iconfinder offers tailored API solutions, or the option to add on an Extended Icon Library in their product's own user interface."
helvetica_neue,"By utilising our database into your business environment, we facilitate unlimited possibilities to benefit from the world's largest collection of diverse and exceptional icons."
helvetica_neue,"MyFitnessPal has joined Under Armour and has teamed up with MapMyFitness, Endomondo, and UA Record to form the Connected Fitness Business Division."
helvetica_neue,Connected Fitness is the world's largest digital health and fitness community.We help our community of over 160 million people stay healthier and happier!Learn more at http://myfitnesspal.com/jobs
helvetica_neue,Coursera is an education-focused technology company that connects millions of learners around the world with the skills and knowledge they need to transform their lives and careers.
helvetica_neue,"We're providing access to top-quality university-level education at a previously unimagined scale, empowering learners, organizations, and enterprises to build the skills they need to succeed in the 21st century.Coursera was founded in 2012 by two Stanford Computer Science professors, Daphne Koller and Andrew Ng."
helvetica_neue,"We are headquartered in Mountain View, California, and are backed by top venture firms, including Kleiner Perkins Caufield & Byers, New Enterprise Associates, GSV Capital, International Finance Corporation, Laureate Education Inc, and Learn Capital."
helvetica_neue,"Soci?t? OUEST-FRANCEPr?sident du Comit? ?ditorialFran?ois R?gis HutinPr?sident du DirectoireLouis ?chelard - Directeur de la publicationLe statut associatif :Depuis l\'assembl?e g?n?rale extraordinaire du 9 avril 1990, S.A. Ouest-France d?pend d\'une association loi 1901 ? but non lucratif, l\'? Association pour le soutien des principes de la d?mocratie humaniste ?, pr?sid?e par Jacques Duquesne.Implantation :58 r?dactions dans les 14 d?partements en Bretagne, Basse-Normandie et Pays de la Loire, ainsi qu\'? Paris.2 unit?s de production :? ? Chantepie en Ille-et-Vilaine (5 rotatives)? ? La Chevroli?re en Loire-Atlantique (2 rotatives)52 ?ditions locales papier diff?rentes (en 2016) repr?sentant en moyenne chaque nuit 541 pages et 2 800 photos ainsi que 2 ?ditions num?riques uniquement : l\'?dition du soir"" et l\'?dition FranceR?daction : Fran?ois-Xavier Lefranc, r?dacteur en chefAudience : Diffusion totale 2015 : 712 500 exemplaires (source OJD).2 467 000 lecteurs : source ACPM 2015.Le site www.ouest-france.fr est le 10?me site national d\'informationavec 4,564 millions de visiteurs uniques ; source M?diam?trie.Ouest-France est le premier quotidien fran?ais depuis 1975."
helvetica_neue,Il est le premier quotidien francophone au monde.
helvetica_neue,"Founded in 2011, takealot.com is a leading South African online retailer."
helvetica_neue,"Our mission is to be the most customer-centric online shopping destination in Africa, built around the simple concept that the customer comes first.All of our focus is dedicated to improving the customer experience, from the moment they arrive on our website to the moment their order arrives at their door."
helvetica_neue,"By aligning ourselves to this philosophy, we believe takealot.com will be the #1  shopping destination across Africa.Everyone who works at takealot.com subscribes to the following values:FASTThe success of any business today depends on quick decisions and decisive implementation."
helvetica_neue,"Big does not beat small but fast definitely beats slow.SIMPLIFYMake it easier for customers, refine your ideas, refine them again and when you think you have arrived, refine yet again.INDIVIDUALISEEach and every customer needs to be treated as an individual, it is not about averages, it?s about the individual."
helvetica_neue,"Obsess about the customer.SMARTSystems are important, resources are important, but the best people are the most important asset to any business."
helvetica_neue,"This does not mean that the company panders to individual whims and fancies, this means that the company will only employ the most dedicated, smart, results-orientated, team players around.FUNYou have to love what you are doing; if you don?t then you should reconsider working here.ITERATE & INNOVATEInnovation is not about ground-sweeping changes but about consistent, everyday, iterative improvement."
helvetica_neue,"This applies to every work stream in the business.DO ITIf you see a problem, find the solution, it's your responsibility not someone else?s."
helvetica_neue,"Be accountable.WISESpend only where it needs to be spent and spend wisely.DIRECTWe value strong relationships in all areas encouraging authentic, thorough, complete, direct and effective communication."
helvetica_neue,We are robust in debate and challenge each other to be the best.
helvetica_neue,Thrillist means fun; we are the essential resource for how to spend your time and money.
helvetica_neue,"We're eaters, drinkers, travelers, and doers."
helvetica_neue,We serve the curious and believe that new experiences are what drive the richest lives.
helvetica_neue,"We bring our passion, expertise, and taste to bear on the things that are truly worth your time and money."
helvetica_neue,"Life?s for living, and that?s why we?re here."
helvetica_neue,Today will be great.
helvetica_neue,"In December 2016, Thrillist joined forces with NowThis, The Dodo and Seeker to form Group Nine Media.https://www.facebook.com/Thrillist/ https://twitter.com/Thrillisthttps://www.instagram.com/thrillist/"
helvetica_neue,Francotel Yellow Pages Pro Network
helvetica_neue,"For 118 years, Vogue has been America?s cultural barometer, putting fashion in the context of the larger world we live in- how we dress, live, socialize; what we eat, listen to, watch; who leads and inspires us.From its beginnings to today, three central principles have set Vogue apart: a commitment to visual genius, investment in storytelling that puts women at the center of the culture, and a selective, optimistic editorial eye.Vogue?s story is the story of women, of culture, of what is worth knowing and seeing, of individuality and grace, and of the steady power of earned influence."
helvetica_neue,"For millions of women each month, Vogue is the eye of the culture, inspiring and challenging them to see things differently, in both themselves and the world."
helvetica_neue,"We offer a wide range of banking services for individuals, including multipurpose lending, deposit safekeeping, bank card issuance and carrying out of money transfers."
helvetica_neue,VTB24 offers you the possibility of carrying out transactions with your bank account remotely via telephone or the Internet
helvetica_neue,"Launched in 2012, Lazada is the number-one online shopping and selling destination in Southeast Asia ? present in Indonesia, Malaysia, the Philippines, Singapore, Thailand and Vietnam."
helvetica_neue,"As the pioneer of the eCommerce ecosystem in Southeast Asia, Lazada helps more than 135,000 local and international sellers as well as 3,000 brands serving the 560 million consumers in the region through its marketplace platform, supported by a wide range of tailored marketing, data, and service solutions.With over 250 million SKUs available, Lazada offers the widest range of products in categories ranging from consumer electronics to household goods, toys, fashion, sports equipment and groceries."
helvetica_neue,"Focused on delivering an excellent customer experience, it offers multiple payment methods including cash-on-delivery, comprehensive customer care and hassle-free returns through its own first and last mile delivery arm supported by more than 100 logistics partners."
helvetica_neue,Lazada Group is majority owned by Alibaba Group Holding Limited (NYSE: BABA).
helvetica_neue,"At Orange we have one priority: provide an incomparable experience!With its strategic project, Essentials2020, Orange has set itself the task of ensuring it is ever-present to connect every individual to what is essential to them, and to provide a unique daily customer experience by designing the digital services that allow all our customers to enjoy securely what is essential to them.We will achieve our ambition with five action levers and a single, dynamic approach, as an efficient and responsible digital company:  -  Offering enriched connectivity  -  Reinventing the customer relationship  -  Building an employer model that combines the digital with the human  -  Supporting the transformation of corporate customers  -  Diversifying by capitalizing on our assetsJoin us and let?s build our world of progress for everyone."
helvetica_neue,"Macworld for IDG: We are the premier source for news, reviews, help and how-to, videos, and podcasts for the Apple market, including the Mac, Mac software, Mac OS X, iOS, iPhone and the Apple Watch."
helvetica_neue,"Along with reviews of Mac-compatible hardware such as printers, digital cameras, and displays, Macworld reviews iPod cases, headphones, speakers, and accessories, and iPhone-related products."
helvetica_neue,El marketing es una pieza clave de cualquier compa??a.
helvetica_neue,"El mundo digital no se detiene, cada d?a es m?s complejo, donde son necesarias estructuras din?micas flexibles que se adapten al entorno."
helvetica_neue,"Un equipo 100% digital y con experiencia, nativos en el medio que entienden la filosofia digital es una de las claves para poder asesorar a nuestros clientes."
helvetica_neue,SunTrust Pte Ltd is born out of a joint venture between Infosun Technologies Pte Ltd and infoTrust Singapore Pte Ltd.
helvetica_neue,Together they bring more than 20 years of experience in the field of IT solutions.
helvetica_neue,SunTrust is established with aim to be premier IT consultant and service provider with the capacity and experience of providing strategic technology solutions that achieve real business results.
helvetica_neue,SunTrust is determined to provide simple & innovative IT solutions to customers through its expertise and in-depth analysis of client requirement.SunTrust is at the forefront of revolutionizing the information technology arena by providing the best products and services to a wide range of industries and enterprises.
helvetica_neue,"The company?s strategy which is elucidated by a determined and compelling focus on convergence and innovation, strives to establish SunTrust as a synthesized speculator and benchmark for new IT services globally.SunTrust offers customised IT and Cloud solutions hosted on Microsoft Windows Azure."
helvetica_neue,The software platform provided by us can entirely be accessed over the web.
helvetica_neue,"There is no requirement of hardware or software to be installed ? just login to the system and start your work.Backed by a large in-house team of project managers, IT system engineers, IT developers and programmers as well as a fully operational outsourcing and call center, SunTrust is changing the way businesses market to and interact with their customers, one business at a time."
helvetica_neue,Wikimapia is an open-content collaborative mapping project that aims to mark and describe all geographical objects in the world.
helvetica_neue,It combines an interactive web map with a geographically-referenced wiki system.
helvetica_neue,"On the October, 2013 the project's website claimed that registered users and guests have already marked over 22,000,000 objects."
helvetica_neue,In eigener Sache Diese Ausgabe ist die letzte Ausgabe von Finanzen & B?rse .
helvetica_neue,"Seit 2003, also zw?lf Jahre lang, war Finanzen & B?rse eine Institution in der deutschsprachigen B?rsenlandschaft."
helvetica_neue,"Wir bedanken uns herzlich bei allen unseren Lesern in Deutschland, ?sterreich und der Schweiz f?r ihre jahrelange Treue Unter Umst?nden aber ist es nur ein Abschied auf Zeit."
helvetica_neue,Denn m?glicherweise erhalten Sie zuk?nftig in unregelm??igen Abst?nden spannende Sonderpublikationen zu spannenden B?rsenthemen.
helvetica_neue,Einstweilen aber w?nsche ich Ihnen im Namen unseres Teams alles Gute
helvetica_neue,Now hiring awesome talent in all of our locations!
helvetica_neue,Check www.kayak.com/careersOur mission at KAYAK is to provide the world?s favorite travel planning tools.
helvetica_neue,"With every query, KAYAK searches other sites to show travelers the information they need to find the right flights, hotels, rental cars and vacation packages."
helvetica_neue,"And because our tech team is always on the lookout looking for ways to make travel planning and trip management even easier, we offer a variety of tools and features such as KAYAK Trips, Explore and Price Forecast and are constantly evolving our app, Facebook Messenger and Slack bots, Alexa skill and related A.I."
helvetica_neue,"innovations.In addition to KAYAK, we manage a portfolio of metasearch brands including: momondo, Cheapflights, SWOODOO, checkfelix and Mundi that together process more than two billion consumer queries a year."
helvetica_neue,KAYAK is an independently managed subsidiary of The Priceline Group and operates sites in more than 60 countries and territories.
helvetica_neue,"To find out more, visit KAYAK.com"
helvetica_neue,"For the first time in modern history, the 13 trillion dollar financial services industry is being modernized."
helvetica_neue,Blockchain is at the forefront of this revolution.
helvetica_neue,Our software is helping millions across the globe - from single individuals to the largest institutions.
helvetica_neue,"We have raised over 70M in capital from top tier investors including Lightspeed Venture Partners, GV, Lakestar, Virgin, Nokota Management, Wicklow Capital, and Sir Richard Branson.Our Guiding PrinciplesChallenge convention."
helvetica_neue,We challenge the status quo and transcend the boundaries of today to create an open financial future that supports the broadest global community possible.
helvetica_neue,We?ve been told that getting to where we are today would be impossible so we decided we were just getting started.Empower the end-user.
helvetica_neue,Our customers should own their financial future so we empower them to ?Be Your Own Bank?.
helvetica_neue,Our users come first.Sanctify security.
helvetica_neue,Our users? security and privacy are critical to our success and we will not forsake them in service of our ambition.Be humble.
helvetica_neue,Be honest.
helvetica_neue,Be human.
helvetica_neue,"We build connections with each other and our users by communicating frequently, authentically and openly and we build trust by doing what we say we?ll do."
helvetica_neue,"We?re big on accountability and high standards, but not on unnecessary rules.Delight in the details."
helvetica_neue,We believe we cannot get the big things right if we don?t get the little things right first.
helvetica_neue,Sometimes that makes things harder.
helvetica_neue,"Luckily, we?re ok with hard."
helvetica_neue,"We believe the more connected people are, the more opportunities they have."
helvetica_neue,"That's why we help create a brilliant connected future for everyone, everyday.That?s why we build technology and content solutions that are simple and easy to use, including Australia?s largest and fastest national mobile network.That?s why we strive to serve and know our customers better than anyone else ? offering a choice of not just digital connection, but digital content as well."
helvetica_neue,"And that?s why we have an international presence spanning 15 countries, including China.In the 21st century, opportunity belongs to connected businesses, governments, communities and individuals.As Australia?s leading telecommunications and information services company, Telstra is proud to be helping our customers improve the ways in which they live and work through connection."
helvetica_neue,Cam4 is a leading Internet-based social networking and adult entertainment company operating one of the most heavily-trafficked websites in the world.
helvetica_neue,"Cam4 provides it's customers with free adult webcams, appealing to all genders and sexual persuasions."
helvetica_neue,Members can interact with each other via live webcams for free.
helvetica_neue,"Cam4 is a blend of social networking, online personals, live and recorded video, online chat, instant messaging, photo and video sharing, blogging, message board, and email."
helvetica_neue,FOUNDED BY FRIENDS.
helvetica_neue,"RUN BY FOUNDERS.PLEXGROUP is an independent, international branding, design &  architecture practice run by a multi-faceted group of founders.PLEX: DESIGN AND BRANDINGPLEX is the design agency within PLEXGROUP."
helvetica_neue,"We work closely with our clients to develop branding and strategy design from concept to completion.aPLEX: ARCHITECTURE AND BRANDINGaPLEX is the architecture firm within PLEXGROUP that specializes in architecture for companies, products and brands.We like to have all specialists in-house."
helvetica_neue,"Therefore, we can meet the entire value chain of communication design - with our 30 staff from design, strategy, architecture, IT and web programming to pre-press."
helvetica_neue,"Autoblog drives the future of the transportation conversation with original articles, vehicle reviews, videos and live events, alongside robust shopping tools that help consumers make smart car purchase decisions.Autoblog is an Oath brand."
helvetica_neue,"Foursquare is a technology company that enriches consumer experiences and informs business decisions through a deep understanding of location intelligence.Every month, more than 50 million people use the Foursquare City Guide app, Foursquare Swarm check-in app and websites to discover new places, explore the world and check in."
helvetica_neue,Our community of explorers have left 91 million tips and checked in 12 billion times.
