,mission and vision
Georgia,"With this acquisition, we are expanding into a growing $20 billion worldwide category as the premier global retailer that features exclusive and unique collectible products.General information about GameStop Corp. can be obtained at the company's corporate website."
Georgia,Follow GameStop on Twitter at www.twitter.com/GameStop and find GameStop on Facebook at www.facebook.com/GameStop.
Georgia,"Topix is an entertainment and news media company where more than 18 million people a month find a growing collection of content about celebrities, pop culture, current events and more."
Georgia,"A company that started with news aggregation, since 2014 Topix has focused on producing viral and shareable content for millennials and beyond.Based in Palo Alto, California, Topix LLC is a privately held company with investment from Gannett Co., Inc. (NYSE: GCI), The McClatchy Company (NYSE: MNI) and Tribune Company."
Georgia,"We help brands change, move, sell, mobilize, interact, influence and accelerate and we deliver ideas that shape their future."
Georgia,"Ginja is hyper-local restaurant discovery, food ordering and delivery platform for SE Asia."
Georgia,"Our mobile first, chat integrated technologies aim to improve convenience and efficiency throughout the user ordering journey whilst simultaneously streamlining a restaurants workflow."
Georgia,"Make your communication clear and effective, wherever you write.Grammarly?s AI-powered products help people communicate more effectively."
Georgia,"Millions of users rely on Grammarly every day to make their messages, documents, and social media posts clear, mistake-free, and impactful."
Georgia,"Grammarly is an Inc. 500 company with offices in San Francisco, New York, and Kyiv."
Georgia,"To learn more, visit Grammarly?s website (www.grammarly.com)."
Georgia,PSU is since 2006 the leading Scandinavian security consultancy firm in China.
Georgia,"PSU works as an expert and competency team for larger as well as smaller companies, organizations, institutions and governments and is a trusted supplier to a large number of foreign global and middle sized companies in China.PSU has offices in Beijing and Shanghai and works throughout strategic partnership in Scandinavia and Northern Europe.We protect our clients' most valuable assets; people, brand, reputation and business operations."
Georgia,"Our support and advice enables clients to manage the security, operational and integrity risks that come with doing business internationally."
Georgia,"Our experts have vast experience from the Security Police, intelligence, military special units and business management."
Georgia,"We have extensive knowledge in individual security, intelligence work, method development and crisis management in an international environment."
Georgia,Crunchyroll is a leading global destination and platform for Japanese anime and Asian content.
Georgia,"Through applications including Crunchyroll for iPhone, iPad, Android, Playstation?3, Playstation?4, Xbox LIVE?, AppleTV, Roku, Internet-enabled TVs, set-top boxes, affiliate websites and its own streaming website, Crunchyroll delivers more than 25,000 episodes and 15,000 hours of officially-licensed content from leading Asian media producers direct to viewers translated professionally in multiple languages within minutes of TV broadcast."
Georgia,"The company was founded in 2006 and now has over 750,000 paid subscribers and is a Top 10 SVOD service.Crunchyroll, an Ellation company, is backed by notable Silicon Valley angel investors, TV Tokyo, and the Chernin Group."
Georgia,LightInTheBox is a global online retail company that delivers products directly to consumers around the world.
Georgia,"Founded in 2007, LightInTheBox has offered customers a convenient way to shop for a wide selection of lifestyle products at attractive prices through www.lightinthebox.com, www.miniinthebox.com, and other websites, which are available in multiple major languages."
Georgia,"LightInTheBox offers products in the three core categories of apparel, small accessories and gadgets and home and garden.LightInTheBox's innovative data-driven business model allows itself to offer customized products, such as wedding dress and evening dress, at scale for optimal marketing, merchandising and fulfillment."
Georgia,"For more information, please visit: www.lightinthebox.com"
Georgia,"Bandcamp is a thriving, global community where fans discover new music and directly support the artists who make it."
Georgia,"In a world where image matters, boring isn't an option."
Georgia,"PicMonkey helps everyday creatives design compelling images that make a point, express a view, and leave an impression."
Georgia,We?re a growing team of experienced professionals?plus one monkey?who believe that our greatest competition is our last release.
Georgia,"We live to beat ourselves at our own game, always topping what we?ve done with more features and more cowbell."
Georgia,Ride with us as we take PicMonkey's photo editing and designs tools to new heights.
Georgia,The National Lottery is currently a leading gambling and scratch card operator in Bulgaria.
Georgia,"Established in 2012, the National Lottery accounts for 92% of the scratch card market in the country and has 28 scratch cards & 7 lotto games in its portfolio as well as an online betting platform."
Georgia,"With 25, 000 POS spread across the country & several exclusive National Lottery POS situated in some of the most prestigious locations, the company has ensured its firm presence on the market."
Georgia,The National Lottery has pledged to uphold high standards of conduct to ensure premium quality service to its customers.
Georgia,"Our team consists of highly qualified and motivated specialists with extensive background in IT, marketing, sales and logistics."
Georgia,"Additionally, we work with some of the most prominent retailers and media partners in Bulgaria."
Georgia,Our international partners are some of the global leaders in the industry.
Georgia,http://www.polyvore.com/cgi/aboutPolyvore is a technology company pioneering a huge space: social commerce.
Georgia,"People come to our site every month where they're empowered to create, share, discover and shop, using our cutting-edge tools.Our business is exploding because our model turns traditional commerce on its head, allowing consumers to voice and discover what they like online."
Georgia,"Our platform lets people mix and match products they love in unique, creative ways, while offering brands deep insight into their customers.We?re a product and engineering-driven team of smart, creative people who work in an open, collaborative environment."
Georgia,"Come help us build an amazing company that is disrupting commerce across industries, devices and countries."
Georgia, We are a think tank with a mission to build vibrant and tolerant societies were our leaders are accountable and open to the participation of all people.
Georgia,"Through our expansive network we seek to strengthen respect for human rights,to assure greater fairness in political, legal, and economic systems historically only available to the elite."
Georgia,"We build alliances with like-minded organizations  and peers addressing inequalities including race, class, gender, sexual orientation, and citizenship."
Georgia,We believe in holding those in power accountable for their actions and in increasing the power of historically excluded groups.
Georgia,We believe in encouraging critical debate and respecting diverse opinions.
Georgia,"Our mission is to give the the brightest young minds  regardless of race, gender or sexual orientation the opportunity will innovate in areas where old industries and governments have failed."
Georgia,"ZEDO, Inc. is a platform offering high impact formats."
Georgia,"Known for technical innovation and ability to scale, ZEDO offers publishers products and services - including ad serving - and high impact formats with 99% viewable impressions."
Georgia,"ZEDO also serves advertisers through ZINC, a suite of high impact formats including video and native ads on premium sites."
Georgia,"Founded in 1999, ZEDO is headquartered in San Francisco with offices in New York, Los Angeles, Chicago, Seattle, and Phoenix, and development centers in Russia and India."
Georgia,"As the largest independent ad server and the developer of high impact video formats for mobile devices, the company is distinguished by its global reach and technology leadership."
Georgia,Evite is the world?s leading digital platform for bringing people together to celebrate their most important life moments.
Georgia,"With over 32 million registered users, Evite has sent more than 2 billion event invitations in its history, enabling approximately 3 billion unique face-to-face connections across all types of gatherings."
Georgia,"Through easy-to-use online and text invitations, a private sharing feed for event photos and conversations, and inspiring video content, Evite provides inspiration and tools to make your get-togethers effortless and even more memorable."
Georgia,"About Ranker:Ranker is the #1 online destination for broad, opinion-based, crowdsourced rankings of everything."
Georgia,"The company's technology is centered on user engagement, turning its lists into the ?best possible rankings? based on the wisdom of crowds."
Georgia,"A Quantcast Top 50 site, Ranker attracts more than 50 million monthly unique visitors."
Georgia,"As a result, Ranker has one of the world?s largest databases of opinions with more than 350 million votes gathered on over 1.1 million items."
Georgia,"Follow Ranker on Facebook at facebook.com/Ranker and on Twitter @Ranker.Ranker was founded by Clark Benson, a lifelong entrepreneur with four prior successful startups."
Georgia,"The last was eCrush, a top 10 online dating service (acquired by Hearst)."
Georgia,"Ranker is backed by Draper Associates, Rincon Venture Partners, Siemer Ventures, Chris Sacca/Lowercase Capital, Data Collective, BullPen Capital, TenOneTen Ventures and Tech Coast and Pasadena Angels."
Georgia,REAL SIMPLE brings you moments of joy and peace and helps make life easier by giving practical and inspiring solutions for both the everyday and special occasions.
Georgia,"BMI was founded in 1939 by forward-thinkers who wanted to represent songwriters in emerging genres, like jazz, blues and country, and protect the public performances of their music."
Georgia,"Operating on a non-profit-making basis, BMI is now the largest music rights organization in the U.S. and is still nurturing new talent and new music."
Georgia,"BMI represents more than 800,000 songwriters, composers, and publishers with nearly 13 million musical works."
Georgia,El marketing es una pieza clave de cualquier compa??a.
Georgia,"El mundo digital no se detiene, cada d?a es m?s complejo, donde son necesarias estructuras din?micas flexibles que se adapten al entorno."
Georgia,"Un equipo 100% digital y con experiencia, nativos en el medio que entienden la filosofia digital es una de las claves para poder asesorar a nuestros clientes."
Georgia,"Cosmopolitan Televisi?n es un canal de televisi?n privado espa?ol, de pago, que gestiona la sociedad ""Hearst Entertainment & Syndication""."
Georgia,La cadena comenz? sus emisiones el 1 de marzo de 2000 y su prop?sito era crear un canal exclusivo para mujeres.
Georgia,Dado su ?xito el canal se exporta posteriormente en 2002 a Am?rica Latina y a principios de 2008 a Canad?.
Georgia,This is a dummy page...!!
Georgia,!
Georgia,The original mission for Social Security was to promote economic security for the nation?s people.
Georgia,"Chances are, you either receive Social Security benefits or know someone who does."
Georgia,"We provide financial protection for nearly 64 million individuals and families, including veterans, the chronically ill, widows and widowers, the children of deceased parents, retirees, and people with disabilities."
Georgia,"We are there throughout life?s journey, helping secure today and tomorrow.Join us today, www.SocialSecurity.gov/careers"
Georgia,"HSN is a leading interactive entertainment and lifestyle retailer, offering a curated assortment of exclusive products and top brand names to its customers."
Georgia,"HSN incorporates entertainment, inspiration, personalities and industry experts to provide an entirely unique shopping experience."
Georgia,"At HSN, customers find exceptional selections in Health & Beauty, Jewelry, Home/Lifestyle, fashion/Accessories, and Electronics."
Georgia,"HSN broadcasts live to 96 million households in the US in HD 24/7 and its website - hsn.com features more than 50,000 product videos."
Georgia,"Mobile applications include HSN apps for iPad, iPhone and Android."
Georgia,"HSN, founded 36 years ago as the first shopping network, is an operating segment of HSN, Inc. (Nasdaq: HSNI)."
Georgia,"For more information, please visit HSN.com, or follow @HSN on Facebook and Twitter."
Georgia,PopMyAds is an international real-time advertising trading platform that helps businesses of all sizes leverage their online assets to generate ROI.
Georgia,The aim of the platform is to connect global advertisers with quality content publishers that meet their brand needs.
Georgia,Publishers are able to monetize their digital content and/or properties with relevant ad campaigns at industry-leading rates.
Georgia,"Conversely, brand advertisers are able to reach and engage with their targeted audience across a select network of top-tier worldwide publishers."
Georgia,"Each month, we serve more than 150 million ad impressions across the globe on all major desktop and mobile devices.Top #719 website of the world: Alexa Ranking (January 2017)."
Georgia,Comenity Bank and Comenity Capital Bank are the private-label and co-branded credit card banking subsidiaries of Alliance Data.
Georgia,"Comenity Bank was formed as World Financial Network National Bank in 1989 to provide private label credit card services to the various retail establishments owned by Limited Brands and its subsidiaries, and their customers."
Georgia,Comenity Capital Bank (formerly World Financial Capital Bank) is a Utah Industrial Bank originally chartered in 2003.
Georgia,"Both banking subsidiaries underwrite credit programs on behalf of more than 110 partners, many of which are some of North America's best-known retail brands."
Georgia,"ATT INOX? is the leading producer of stainless steel elements, mainly drainage systems.All our actions are based on the following principles: sustained high quality of products and services, constant improvement and expansion of our range products as well as reliability and timeliness.We work for Customers in food, chemical, pharmaceutical and wide variety of construction and installation industries.Through combining innovative projects with advanced technology, modern machine park and years of experience, we offer products and services that meet the highest standards.Our solutions reflect needs of our Customers, such as on-site adaptation processes during product installation."
Georgia,"Each phase of the order completion ? from design, through workmanship to installation ? is supervised and consulted with you by our specialists, just to make sure you get your final product according to your requirements.ATT is a team of engineers who combine their know- -how and passion with creativity and long-standing experience."
Georgia,"The combination of these features brings about a certain, unique quality of projects."
Georgia,Their comprehensive technical knowledge of construction and industry realities makes it possible to adjust complex solutions to individual needs of our Customers.
Georgia,"TripAdvisor, the world's largest travel site**, enables travelers to unleash the full potential of every trip."
Georgia,"With over 570 million reviews and opinions covering the world's largest selection of travel listings worldwide -- covering 7.3 million accommodations, airlines, attractions, and restaurants -- TripAdvisor provides travelers with the wisdom of the crowds to help them decide where to stay, how to fly, what to do and where to eat."
Georgia,TripAdvisor also compares prices from more than 200 hotel booking sites so travelers can find the lowest price on the hotel that's right for them.
Georgia,"TripAdvisor-branded sites are available in 49 markets, and are home to the world's largest travel community of 455 million average monthly unique visitors*, all looking to get the most out of every trip."
Georgia,TripAdvisor: Know better.
Georgia,Book better.
Georgia,"Go better.TripAdvisor, Inc. (NASDAQ: TRIP), through its subsidiaries, manages and operates websites under 20 other travel media brands: www.airfarewatchdog.com, www.bookingbuddy.com, www.citymaps.com, www.cruisecritic.com, www.familyvacationcritic.com,   www.flipkey.com, www.thefork.com (including www.lafourchette.com, www.eltenedor.com, www.iens.nl and www.dimmi.com.au), www.gateguru.com, www.holidaylettings.co.uk, www.holidaywatchdog.com, www.housetrip.com, www.jetsetter.com, www.niumba.com, www.onetime.com, www.oyster.com, www.seatguru.com, www.smartertravel.com, www.tingo.com, www.vacationhomerentals.com and www.viator.com."
Georgia,"*Source: TripAdvisor log files, average monthly unique visitors, Q3 2017**Source: comScore Media Metrix for TripAdvisor Sites, worldwide, July 2017"
Georgia,"Somos una Instituci?n que ofrece calidad educativa especializada en las carreras de la Hospitalidad, la Gastronom?a y la Aviaci?n Comercial."
Georgia,"Contamos con una impecable trayectoria de m?s de 30 a?os dedicados a ofrecer un servicio de excelencia y tecnolog?a avanzada a nuestros estudiantes.La ense?anza de las carreras y programa que ofrecemos es compatible con las exigencias internacionales, para ello ponemos a disposici?n de nuestros alumnos conocimientos, experiencia, servicios y sistemas globalizadores mediante convenios con empresas e instituciones de importancia mundial."
Georgia,"About Oracle NetSuite Global Business Unit:Oracle NetSuite Global Business Unit pioneered the Cloud Computing revolution in 1998, establishing the world?s first company dedicated to delivering business applications over the internet."
Georgia,"Today, Oracle NetSuite Global Business Unit provides a suite of cloud-based financials / Enterprise Resource Planning (ERP), HR and omnichannel commerce software that runs the business of companies in more than 100 countries."
Georgia,"For more information, please visit http://www.netsuite.com."
Georgia,"Work @ Oracle NetSuite:Picture yourself building a successful career at Oracle NetSuite?working alongside talented, driven individuals to help fast-growing, mid-size organizations and large enterprises achieve their business goals with one of the world?s leading providers of cloud-based financials / ERP, HR, Professional Services Automation (PSA) and omnichannel commerce software suites."
Georgia,"UCLA offers a combination that?s rare, especially among public research universities."
Georgia,"The breadth, depth and inspired excellence among academic programs?from the visual and performing arts to the humanities, social sciences, STEM disciplines and health sciences?add up to endless opportunity."
Georgia,"The location is unmatched: a campus that is unexpectedly picturesque and compact, set in a thriving and diverse global city."
Georgia,Sportzender
Georgia,Bringing everything that matters in business and financial news.
Georgia,"We want to help you make money.TheStreet, Inc. is a leading digital financial media company reporting on the latest investing trends and analysis to investors around the world."
Georgia,"With an unmatched suite of digital services, TheStreet has all the tools and insight needed to help you make the best financial decisions.You can also find us @TheStreet on...Facebook: facebook.com/thestreet Twitter: https://twitter.com/thestreetInstagram: http://instagram.com/thestreet/"
Georgia,You know LivingSocial as the marketplace to buy and share the best things to do in your city and beyond.
Georgia,"And while we're bringing excitement and value to our merchants and consumers, we're also committed to creating a world-class environment for our employees."
Georgia,"Our talented LivingSocialites bring an all-hands-on-deck approach to our work, taking pride in being collaborative, creative, and flexible."
Georgia,"If you?re passionate about working as part of a team to drive value to businesses of all sizes, you may have just found your new home."
Georgia,"Esquire, an Alexander Gallo Holdings Company, offers a service area for each stage of litigation - staffed with specialists dedicated to their field."
Georgia,We have the experience and depth to deliver any support service you may need and your dedicated Esquire project manager ensures that your support is seamless from beginning to end.Partner with us and enjoy a full range of services including:    * State-of-the-art court reporting      * Full electronic discovery support    * Demonstrative evidence preparation    * Strategic staffing solutions    * Corporate servicesThe integrated services offered by Esquire will help you increase your team?s productivity and effectiveness while decreasing your overall costs.
Georgia,"Plus, you?ll enjoy local, personal attention with convenient access to our services ? wherever the case takes you."
Georgia,FetLife is the world?s largest free kinky social network.
Georgia,"Similar to Facebook but built and run by kinksters, for kinksters."
Georgia,It?s our mission to help make people feel comfortable with who they are sexually so that they don't have to ever feel alone.
Georgia,There is nothing worse than feeling alone.
Georgia,Manage professional Athletes in all aspects of a carrier.
Georgia,"apartmenttherapy.com and thekitchn.comMissionHelping people make their homes more beautiful, organized and healthy by connecting them to a wealth of resources, ideas and community online.What We BelieveA calm, healthy, beautiful home is a necessary foundation for happiness and success in the world."
Georgia,Creating this home doesn't require large amounts of money or space.
Georgia,"It requires inspiration, connection to resources and motivation to do something about it.The basic elements of good home design can be learned and achieved by all.Simplicity and luxury are not mutually exclusive.Our GoalTo connect people to the resources they need to improve their homes, while reducing their reliance on stuff."
arial,"Badoo is the largest social discovery network in the worldOur mission is to provide the best technology for people to meet, because happiness is better shared."
arial,"We have 370 million members, and more than 400,000 new people join every day.What's it like to work at Badoo?"
arial,"As a rapidly growing start-up, we specialise in innovation, flexibility and agility, and our teams are focused towards cross-platform mobile development."
arial,Our apps are available in over 45 languages.
arial,The Android app alone has been downloaded over 100 million times.Our cool London and Moscow offices are multicultural environments  - between us we speak over two dozen languages!
arial,"We?re a sociable bunch, too."
arial,"We have a vibrant office culture, well-stocked kitchens, a games room and regular team activities."
arial,"This means plenty of opportunities to chill out, have fun and get to know each other.How can I get a job at Badoo?"
arial,We're always looking for talented and enthusiastic people to join our team!
arial,Check out our latest jobs on LinkedIn or at team.badoo.com/jobs/all-positions
arial,"Specializing in Drupal, our studio provides modern and affordable digital solutions to modern and innovative brands."
arial,"We?re a unique hybrid of design, development, and marketing with the collective goal of making the web a better, simpler and easier place."
arial,"Streamlined and efficient, we collaborate with you to identify your needs and create a solution designed specifically for your brand and budget."
arial,And we partner with you beyond the launch to give you the digital support you need ? without the traditional agency overhead.
arial,Flickr is almost certainly the best online photo management and sharing application in the world.
arial,"Show off your favorite photos and videos to the world, securely and privately show content to your friends and family, or blog the photos and videos you take with a cameraphone.Additionally, Flickr operates a private speakeasy in downtown San Francisco, where notable internet celebrities often function as guest bartenders.The current CEO of Flickr is Daniel ""Waferbaby""\u200b Bogan, who won the position by defeating all other contenders in a breakdancing competition."
arial,"ATT INOX? is the leading producer of stainless steel elements, mainly drainage systems.All our actions are based on the following principles: sustained high quality of products and services, constant improvement and expansion of our range products as well as reliability and timeliness.We work for Customers in food, chemical, pharmaceutical and wide variety of construction and installation industries.Through combining innovative projects with advanced technology, modern machine park and years of experience, we offer products and services that meet the highest standards.Our solutions reflect needs of our Customers, such as on-site adaptation processes during product installation."
arial,"Each phase of the order completion ? from design, through workmanship to installation ? is supervised and consulted with you by our specialists, just to make sure you get your final product according to your requirements.ATT is a team of engineers who combine their know- -how and passion with creativity and long-standing experience."
arial,"The combination of these features brings about a certain, unique quality of projects."
