,mission and vision
font,starts
Helvetica,"Founded in 2004, Facebook?s mission is to give people the power to build community and bring the world closer together."
Helvetica,"People use Facebook to stay connected with friends and family, to discover what?s going on in the world, and to share and express what matters to them.Facebook is defined by our unique culture ? one that rewards impact."
Helvetica,We encourage people to be bold and solve the problems they care most about.
Helvetica,"We work in small teams and move fast to develop new products, constantly iterating."
Helvetica,"The phrase ?this journey is 1% finished,? reminds us that we?ve only begun to fulfill our mission to bring the world closer together."
Helvetica,"For a full listings of our jobs, visit www.facebook.com/careers*Thank you for visiting our page."
Helvetica,"We welcome conversation and reserve the right to remove any comments that constitute harassment, hate speech, abuse, libel, or spam."
Helvetica,"Yahoo is a guide focused on informing, connecting, and entertaining."
Helvetica,"By creating highly personalized experiences for our users, we keep people connected to what matters most to them, across devices and around the world."
Helvetica,"In turn, we create value for advertisers by connecting them with the audiences that build their businesses."
Helvetica,"Yahoo is headquartered in Sunnyvale, California, and has offices located throughout the Americas, Asia Pacific (APAC) and the Europe, Middle East and Africa (EMEA) regions."
Helvetica,"For more information, visit the pressroom (pressroom.yahoo.net) or the Company?s blog (yahoo.tumblr.com)."
Helvetica,"Whatever motivates and inspires you, we?re a community that helps you realize your definition of success."
Helvetica,"#InItTogetherFounded in 2003, LinkedIn connects the world's professionals to make them more productive and successful."
Helvetica,"With more than 530 million members worldwide, including executives from every Fortune 500 company, LinkedIn is the world's largest professional network on the Internet."
Helvetica,"The company has a diversified business model with revenue coming from Talent Solutions, Marketing Solutions, and Premium Subscriptions products."
Helvetica,"Headquartered in Silicon Valley, LinkedIn has offices across the globe."
Helvetica,"Founded in 1995 in San Jose, Calif., eBay (NASDAQ:EBAY) is where the world goes to shop, sell and give."
Helvetica,"Whether you?re buying new or used, common or luxurious, trendy or rare ? if it exists in the world, it?s probably for sale on eBay."
Helvetica,"Our great value and unique selection helps every person find their version of perfect, no matter what it is.We equip sellers with the tools, solutions and support they need to grow their businesses and thrive."
Helvetica,"We measure our success by our customers'\u200b success.Our vision for commerce is one that is enabled by people, powered by technology and open to everyone."
Helvetica,"Through our investments in small businesses and commitment to innovation, we?re connecting millions of buyers and sellers around the globe, creating economic opportunity for all.We also reach millions through specialized marketplaces such as StubHub, the world's largest ticket marketplace, and eBay Classifieds sites (e.g."
Helvetica,"Kijiji, Marktplaats, Gumtree), which together have a presence in more than 1,000 cities around the world."
Helvetica,For more information about the company visit http://www.ebayinc.com/our-company/
Helvetica,Pinterest is full of possibilities to design your life.
Helvetica,"Discover recipes, style inspiration, projects for your home and other ideas to try.Need help?"
Helvetica,help.pinterest.comFor more info: about.pinterest.com
Helvetica,People come to Tumblr to expand their perspectives.
Helvetica,"They join a community and a cultural dialogue that exposes them up to new ideas, new passions, and new forms of self-expression."
Helvetica,"People seem to really like this thing we?ve built, and we need smart, humble, funny people to keep it running and growing."
Helvetica,We?re big enough to give you the resources you need and still small enough that you can work on things that matter.
Helvetica,Come work with us.
Helvetica,"GitHub is the best place to share code with friends, co-workers, classmates, and complete strangers."
Helvetica,Over 24 million people use GitHub to build amazing things together across 67 million repositories.
Helvetica,"With the collaborative features of GitHub.com and GitHub Business, it has never been easier for individuals and teams to write faster, better code."
Helvetica,"NAVER Corporation is Korea's premier Internet company, operating the nation's top search portal, Naver (www.naver.com) the nation's largest children's portal, Jr. Naver (jr.naver.com), Korea?s the first online donation portal, Happybean (happybean.naver.com).Starting from the pillars of search, NAVER has rolled out a wide range of innovative and convenient online services that enable people to enjoy their lives."
Helvetica,A number of surveys demonstrate that the company is regarded as an undisputed leader in the online services industry worldwide.
Helvetica,NAVER has emerged as Korea?s largest Internet company in terms of net profit.
Helvetica,"This outstanding growth is largely attributable to the company's efforts to create and introduce stable revenue streams in its core services; for instance, search-oriented advertising services and fee-based games.NAVER outgrew the confines of the national borders."
Helvetica,"Not only did we build a good reputation in Japan and China, but we also trying to set up branches at abroad, forging toward becoming a world-class internet company.Our key mission is to connect users with the best quality services."
Helvetica,"To that end, NAVER remains fully committed to pioneering state-of-the-art technologies based on our continued R&D in technology."
Helvetica,"The BBC is the world?s leading public service broadcaster.Funded primarily through the television licence fee, the BBC provides audiences in the UK with high quality and distinctive services across television, radio and online."
Helvetica,"It informs, educates and entertains - wherever you are, whatever your ageThe BBC maintains a number of separate ventures across the world some of which help fund it?s public services."
Helvetica,"BBC World Service, BBC World News, BBC Worldwide and BBC Monitoring are some of the ways people might encounter it?s services internationally."
Helvetica,"The BBC delivers it?s content through numerous platforms, both directly, via the BBC Iplayer and BBC Store- a new digital service that makes it easy for audiences to buy, enjoy and keep their favourite BBC programmes: http://www.store.bbc.comThe BBC offers a wide range of careers in the areas of Television, Radio, Journalism, Online, Broadcast Technology and Corporate Services."
Helvetica,For a full list of our current vacancies visit www.bbc.co.uk/careers
Helvetica,Contact us for your short term housing needs.
Helvetica,2 months to long term.
Helvetica,Companies and Realtors welcome.
Helvetica,"Founded in 1995 in San Jose, Calif., eBay (NASDAQ:EBAY) is where the world goes to shop, sell and give."
Helvetica,"Whether you?re buying new or used, common or luxurious, trendy or rare ? if it exists in the world, it?s probably for sale on eBay."
Helvetica,"Our great value and unique selection helps every person find their version of perfect, no matter what it is.We equip sellers with the tools, solutions and support they need to grow their businesses and thrive."
Helvetica,"We measure our success by our customers'\u200b success.Our vision for commerce is one that is enabled by people, powered by technology and open to everyone."
Helvetica,"Through our investments in small businesses and commitment to innovation, we?re connecting millions of buyers and sellers around the globe, creating economic opportunity for all.We also reach millions through specialized marketplaces such as StubHub, the world's largest ticket marketplace, and eBay Classifieds sites (e.g."
Helvetica,"Kijiji, Marktplaats, Gumtree), which together have a presence in more than 1,000 cities around the world."
Helvetica,For more information about the company visit http://www.ebayinc.com/our-company/
Helvetica,"ESPN, Inc., The Worldwide Leader in Sports, is the leading multinational, multimedia sports entertainment company featuring the broadest portfolio of multimedia sports assets with over 50 business entities."
Helvetica,"Sports media assets include ESPN on ABC, six domestic cable television networks (ESPN, launched in 1979; ESPN2; ESPN Classic; ESPNEWS; ESPN Deportes; ESPNU), ESPN HD and ESPN2 HD (high-definition simulcast services of ESPN and ESPN2, respectively), ESPN Regional Television, ESPN International (31 international networks and syndication), ESPN Radio, ESPN.com, ESPN The Magazine, ESPN Enterprises, ESPN Zones (sports-themed restaurants licensed by ESPN), and other growing new businesses including ESPN360.com (Broadband), ESPN Mobile Properties (wireless), ESPN On Demand, ESPN Interactive and ESPN PPV."
Helvetica,"Based in Bristol, Ct., ESPN is 80 percent owned by ABC, Inc., which is an indirect subsidiary of The Walt Disney Company."
Helvetica,The Hearst Corporation holds a 20 percent interest in ESPN.
Helvetica,"The BBC is the world?s leading public service broadcaster.Funded primarily through the television licence fee, the BBC provides audiences in the UK with high quality and distinctive services across television, radio and online."
Helvetica,"It informs, educates and entertains - wherever you are, whatever your ageThe BBC maintains a number of separate ventures across the world some of which help fund it?s public services."
Helvetica,"BBC World Service, BBC World News, BBC Worldwide and BBC Monitoring are some of the ways people might encounter it?s services internationally."
Helvetica,"The BBC delivers it?s content through numerous platforms, both directly, via the BBC Iplayer and BBC Store- a new digital service that makes it easy for audiences to buy, enjoy and keep their favourite BBC programmes: http://www.store.bbc.comThe BBC offers a wide range of careers in the areas of Television, Radio, Journalism, Online, Broadcast Technology and Corporate Services."
Helvetica,For a full list of our current vacancies visit www.bbc.co.uk/careers
Helvetica,BuzzFeed is the leading independent digital media and tech company delivering news and entertainment content to a global audience.
Helvetica,"BuzzFeed covers breaking news, produces original video, and creates content that people want to share on the web."
Helvetica,"We have offices in 18 cities around the world and more than 1500 employees including reporters, video producers, data scientists, engineers, brand strategists, and more."
Helvetica,Amazon strives to be Earth's most customer-centric company where people can find and discover virtually anything they want to buy online.
Helvetica,"By giving customers more of what they want - low prices, vast selection, and convenience - Amazon continues to grow and evolve as a world-class e-commerce platform.Founded by Jeff Bezos, the Amazon.com website started in 1995 as a place to buy books because of the unique customer experience the Web could offer book lovers."
Helvetica,Bezos believed that only the Internet could offer customers the convenience of browsing a selection of millions of book titles in a single sitting.
Helvetica,"During the first 30 days of business, Amazon fulfilled orders for customers in 50 states and 45 countries - all shipped from his Seattle-area garage.Amazon's evolution from Web site to e-commerce partner to development platform is driven by the spirit of innovation that is part of the company's DNA."
Helvetica,The world's brightest technology minds come to Amazon.com to research and develop technology that improves the lives of shoppers and sellers around the world.
Helvetica,"Our mission is to connect people to the knowledge they need to become better at what they do.We believe that reading opens doors, whether that?s performing better at work, mastering a craft, learning something new or following current events."
Helvetica,"Reading is an important tool for those with curious minds, and feedly is an app that enables readers to connect with the websites and sources about the things they are most passionate."
Helvetica,"Minneapolis-based Target Corporation (NYSE: TGT) serves guests at over 1,800 stores and at Target.com."
Helvetica,"Since 1946, Target has given five percent of its profit to communities, which today equals millions of dollars a week."
Helvetica,"For more information, visit Target.com/Pressroom."
Helvetica,"For a behind-the-scenes look at Target, visit ABullseyeView.com or follow @TargetNews on Twitter."
Helvetica,"Business Insider Inc. is publisher of Business Insider, Tech Insider, INSIDER, and ten international editions of Business Insider."
Helvetica,"Business Insider, the largest business news site in the US and one of the fastest-growing news brands in the world, was launched in 2007. Business Insider pioneered digital-native business news coverage that is real-time, social and mobile at its core."
Helvetica,The site?s desirable audience is the next generation of business leaders.
Helvetica,"Tech Insider was launched in July 2015, and INSIDER, the company's first lifestyle brand, launched in 2016."
Helvetica,The Business Insider network of sites reaches 100 million unique monthly visitors a month.
Helvetica,"The company has a paid subscription research service, Business Insider Intelligence (BII), that offers in-depth insight, data and analysis of the digital landscape, from e-commerce and payments to the Internet of Things and fintech."
Helvetica,"Each year, Business Insider hosts one of the tech industry?s most influential conferences, IGNITION."
Helvetica,Business Insider Inc. is a subsidiary of Axel Springer SE.
Helvetica,"Business Insider is always looking for talented, curious and motivated individuals to join our growing team."
Helvetica,"If you are interested in knowing more, please check out our career page: http://read.bi/1s2IVk0"
Helvetica,"At Pandora, we're a unique collection of engineers, musicians, designers, marketers, and world-class sellers with a common goal: to enrich lives by delivering effortless personalized music enjoyment and discovery."
Helvetica,"People?the listeners, the music makers, and our employees?are at the center of our purpose and everything we do."
Helvetica,"Actually, employees at Pandora are a lot like the service itself: bright, eclectic, and innovative."
Helvetica,"Collaboration is the foundation of our workforce, and we?re looking for smart individuals who are self-motivated and passionate to join us."
Helvetica,Be a part of the engine that creates the soundtrack to life.
Helvetica,Der Anbieter beziehungsweise sein Webspace-Provider erhebt Daten ?ber jeden Zugriff auf das Angebot so genannte Serverlogfiles .
Helvetica,Zu den Zugriffsdaten geh?ren
Helvetica,"With Spotify, it?s easy to find the right music for every moment ? on your phone, your computer, your tablet and more.There are millions of tracks on Spotify."
Helvetica,"So whether you?re working out, partying or relaxing, the right music is always at your fingertips."
Helvetica,"Choose what you want to listen to, or let Spotify surprise you.You can also browse through the music collections of friends, artists, and celebrities, or create a radio station and just sit back.Soundtrack your life with Spotify."
Helvetica,Subscribe or listen for free.
Helvetica,"The blog reflects aspects of the industry I experience on a daily basis negotiating deals for writers in film, television and publishing."
Helvetica,"As a trusted systems integrator for more than 50 years, General Dynamics Information Technology provides information technology (IT), systems engineering, professional services and simulation and training to customers in the defense, federal civilian government, health, homeland security, intelligence, state and local government and commercial sectors.With professionals worldwide, the company delivers IT enterprise solutions, manages large-scale, mission-critical IT programs and provides mission support services.General Dynamics Information Technology is one of four business units of the General Dynamics Information Systems and Technology business segment."
Helvetica,"Headquartered in Fairfax, Va., General Dynamics Information Technology has major offices worldwide."
Helvetica,The first word in business news.
Helvetica,"Visit bloomberg.com for the latest on global business, markets and more."
Helvetica,Mashable is a media and entertainment company for superfans.
Helvetica,We?re not for the casually curious.
Helvetica,We devour culture and tech.
Helvetica,Our ideas shape the future.
Helvetica,Obsess with us.http://www.mashable.com
Helvetica,Evernote transforms the way you work.
Helvetica,"We design products that fuel inspiration for your projects, from start to finish."
Helvetica,"With Evernote, collect and organize material that molds your work."
Helvetica,"Easily find everything when you need it, from handwritten notes to photos."
Helvetica,"As your project takes shape, present it to colleagues."
Helvetica,Turn notes into a beautiful presentation you can display in a screen-friendly format.
Helvetica,Our goal is to make you work smarter.
Helvetica,Our job is to make sure you get there.
Helvetica,IGN is dedicated solely to the managing world wide investments and assets.
Helvetica,"We deliver innovative solutions in banking, capital markets, wealth and investment management and finance, risk and compliance."
Helvetica,"As the pressures of regulation, cost reduction, and customer expectation grow, we design, build and operate technology for specific operations and entire organizations."
Helvetica,"We collaborate closely with our clients, equipping them to better meet the challenges of today, while preparing them to exploit tomorrow?s opportunities."
Helvetica,"Through our hands-on consulting resources, we go beyond strategy."
Helvetica,"We provide the necessary technology architecture and implementation that well positions our clients to transform and to achieve operational excellence, manage IT complexity, better understand, predict and control risk and develop practical and productive responses to regulation."
Helvetica,"From the vision that our deep industry involvement provides, through to successful delivery, we remain proud that, with our clients, we are forming the future of finance."
Helvetica,"Founded in 1995 in San Jose, Calif., eBay (NASDAQ:EBAY) is where the world goes to shop, sell and give."
Helvetica,"Whether you?re buying new or used, common or luxurious, trendy or rare ? if it exists in the world, it?s probably for sale on eBay."
Helvetica,"Our great value and unique selection helps every person find their version of perfect, no matter what it is.We equip sellers with the tools, solutions and support they need to grow their businesses and thrive."
Helvetica,"We measure our success by our customers'\u200b success.Our vision for commerce is one that is enabled by people, powered by technology and open to everyone."
Helvetica,"Through our investments in small businesses and commitment to innovation, we?re connecting millions of buyers and sellers around the globe, creating economic opportunity for all.We also reach millions through specialized marketplaces such as StubHub, the world's largest ticket marketplace, and eBay Classifieds sites (e.g."
Helvetica,"Kijiji, Marktplaats, Gumtree), which together have a presence in more than 1,000 cities around the world."
Helvetica,For more information about the company visit http://www.ebayinc.com/our-company/
Helvetica,"ZEDO, Inc. is a platform offering high impact formats."
Helvetica,"Known for technical innovation and ability to scale, ZEDO offers publishers products and services - including ad serving - and high impact formats with 99% viewable impressions."
Helvetica,"ZEDO also serves advertisers through ZINC, a suite of high impact formats including video and native ads on premium sites."
Helvetica,"Founded in 1999, ZEDO is headquartered in San Francisco with offices in New York, Los Angeles, Chicago, Seattle, and Phoenix, and development centers in Russia and India."
Helvetica,"As the largest independent ad server and the developer of high impact video formats for mobile devices, the company is distinguished by its global reach and technology leadership."
Helvetica,Goibibo is one of the largest online Flights and Hotels aggregation and booking engines in India.
Helvetica,Goibibo is part of the Go-MMT (ibibo and MakeMyTrip) Group that also owns India\'s No.
Helvetica,"1 online Bus ticketing platform, redBus.in and recently launched car pooling app, ""ibibo Ryde""\u200b."
Helvetica,We are India?s biggest online travel organization with over $5Bn in annual gross sales.
Helvetica,Our mission is to organise the transportation and accommodation industry and connect it with travellers.
Helvetica,"Goibibo.com is experiencing hyper growth, catalysed by mobile and hotels."
Helvetica,Goibibo is no 1 in volume of hotel bookings in India.
Helvetica,Source (MorganStanley\'s report).
Helvetica,It is also the most preferred platform for hotel owners across parameters.
Helvetica,"Goibibo\'s core value differentiator is delivery of the fastest and the most trusted user experiences, be it in terms of quickest search and booking, fastest payments, settlement and refund processes."
Helvetica,Goibibo has grown its hotels booking volumes by 5x in 2015 over the previous year.
Helvetica,70% of hotel bookings take place on Goibibo\'s mobile app.
Helvetica,"The Team -Rajesh Magow, CEO, Goibibo, Co-Founder, Go-MMT groupSanjay Bhasin, COOVikalp Sahni, Co-founder and CTO, GoibiboGO-MMT is the corporate entity of three giants in the Online Travel Industry?Goibibo, MakeMyTrip and RedBus."
Helvetica,"The GO-MMT family celebrates the compounded strengths of their brands, creating what can be called the largest network of flights, hotels, tour operators and travel enablers across the country."
Helvetica,The group company is easily the most sought after corporate in the online travel industry.
Helvetica,Imagine getting to work on the star brands of the online travel domain?that?s the dream you will get to live here at GO-MMT.
Helvetica,"Despite being a giant in the travel industry, GO-MMT is still has a start-up like heart; welcoming wacky ideas, bringing to life great products and encouraging its employees (aka Go trippers) to have an awesome experience."
Helvetica,"GO-MMT invests heavily in the personal well-being of all its employees and provides a work atmosphere charged with positive energy, youth and vibrancy."
Helvetica,"It is a place where one can create a powerful impact with their talent, hard work, zeal and teamwork"
Helvetica,Combining the best in local content and community with cutting edge social media technology to build the next generation of team and affinity properties.The company executes its plan by showcasing its network of local experts ? experienced and trustworthy writers and reporters that are on the campuses focusing only on their specific schools.
Helvetica,Your team.
Helvetica,All the time.
Helvetica,Congratulations!
Helvetica,You just found the official LinkedIn page of happiest e-commerce to work in Indonesia!
Helvetica,"Don?t go just yet, because if you do, you are going to miss out on a happy opportunity."
Helvetica,"As one of the fastest growing e-commerce in Indonesia, elevenia.co.id is a company of happy employers and employees that aims for the happiness of its buyers and sellers.Our business involves giving the best service to our customers, and giving the best support to our sellers."
Helvetica,"As a marketplace, elevenia acts as a platform between our sellers and buyers online."
Helvetica,"We are currently responsible for the business growth of our 33.000 sellers and happiness of our 2,3 million members.Officially launched in March 2014, elevenia now has several achievements including:- Marketing Awards 2015- Best Innovation e-commerceAll of those achievements are nothing without the hard work of our happy employees currently working today at our office."
Helvetica,"As an elevenian, we strongly believe in the positive minds and attitude for the growth of a great company.Come and join our family by sending your CV, or just have a look at our website here: http://www.elevenia.co.id/career.doSee you soon!"
Helvetica,"MSNBC defines news for the next generation with world-class reporting and a full schedule of live news coverage, political analysis and award-winning documentary programming ? 24 hours a day, seven days a week."
Helvetica,Visit us at www.msnbc.com.
Helvetica,"Leading Analytics & Marketing Suite for Instagram - Manage your Instagram activity, Analyze your performance, Engage your communityFAST FACTS- Iconosquare is used by over 150,000 brands."
Helvetica,"Notable clients include 40% of the Fortune 1000 companies as well as Coca-Cola, Nike, Ford, AT&T, Southwest Airlines, American Express, Gap, Starbucks, Ebay, Victoria's Secret among othersWHAT IS ICONOSQUARE?Iconosquare works with your Instagram account to help you grow a social-rich media strategy, effectively interact with your community and measure your efforts with metrics.Iconosquare allows you to:- Promote your Instagram account across other social networks with feed tabs or photo widgets.- Manage your community and their comments on a user-friendly platform.- Analyse your activity through professional statistics.- Engage your community with photo contests: Setup, promote, moderate, monitor and publish results of an Instagram contest all within Iconosquare.Haven?t heard of Iconosquare yet?"
